{"schema_version":"1.0.0","project_id":"novel_example","state_version":"0.1.0","as_of_episode":0,"relationships":[{"relationship_id":"protagonist-inspector","character_ids":["protagonist","inspector"],"public_state":"professional strangers","private_state":"mutual suspicion","trust":10,"tension":70,"unresolved_issue":"the altered ledger","last_evidence":{"episode":0,"source_id":"story_bible:relationship-001"}},{"relationship_id":"protagonist-clerk","character_ids":["protagonist","clerk"],"public_state":"coworkers","private_state":"uneasy dependence","trust":35,"tension":55,"unresolved_issue":"the missing page","last_evidence":{"episode":0,"source_id":"story_bible:relationship-002"}}]}
